Blow-Up: Graphic Abstraction in 1960s Design,2015-09-18,2016-03-20,THE SAINT LOUIS ART MUSEUM IN FOREST PARK,ARTS & ENTERTAINMENT
"St. Louis Speaker Series (seven Tuesday evenings, from October through April)",2015-10-13,2016-04-05,POWELL SYMPHONY HALL IN GRAND CENTER,ARTS & ENTERTAINMENT
Kota: Digital Excavations in African Art (Dates Vary),2015-10-16,2016-03-19,THE PULITZER ARTS FOUNDATION,ARTS & ENTERTAINMENT
Ladies?? Knight: A Female Perspective on Chess,2015-10-29,2016-04-17,WORLD CHESS HALL OF FAME,ARTS & ENTERTAINMENTN
"Kings, Queens, and Castles",2015-10-31,2016-09-11,WORLD CHESS HALL OF FAME,ARTS & ENTERTAINMENT
Carl Richards: MONEY. VISUALIZED.,2016-01-14,2016-03-16,COCA,ARTS & ENTERTAINMENT
Arcangelo Sassolino: Not Human,2016-01-15,2016-04-03,CONTEMPORARY ART MUSEUM ST. LOUIS,ARTS & ENTERTAINMENT
Arlene Shechet: Urgent Matter,2016-01-15,2016-04-03,CONTEMPORARY ART MUSEUM ST. LOUIS,ARTS & ENTERTAINMENT
Interpretations: 15th Biennial Teapot Exhibition,2016-01-15,2016-03-20,CRAFT ALLIANCE CENTER OF ART + DESIGN (DELMAR LOOP),ARTS & ENTERTAINMENT
Lisa Yuskavage: The Brood,2016-01-15,2016-04-03,CONTEMPORARY ART MUSEUM ST. LOUIS,ARTS & ENTERTAINMENT
Ned Vena: Paintings Without Borders 2,2016-01-15,2016-04-03,CONTEMPORARY ART MUSEUM ST. LOUIS,ARTS & ENTERTAINMENT
Peter Sutherland: Forests and Fires,2016-01-15,2016-04-03,CONTEMPORARY ART MUSEUM ST. LOUIS,ARTS & ENTERTAINMENT
Spring Exhibitions at Contemporary Art Museum of St. Louis,2016-01-15,2016-04-03,CONTEMPORARY ART MUSEUM ST. LOUIS,ARTS & ENTERTAINMENT
Tala Madani,2016-01-15,2016-04-03,CONTEMPORARY ART MUSEUM ST. LOUIS,ARTS & ENTERTAINMENT
"A Decade of Collecting Prints, Drawings, and Photographs",2016-01-29,2016-07-17,THE SAINT LOUIS ART MUSEUM IN FOREST PARK,ARTS & ENTERTAINMENT
Her Turn: Revolutionary Women of Chess,2016-02-04,2016-09-04,WORLD CHESS HALL OF FAME,ARTS & ENTERTAINMENT
"2016 Orchid Show: ""Where the Wild Things Grow""",2016-02-06,2016-03-27,MISSOURI BOTANICAL GARDEN,ANNUAL EVENTS
"Spies, Traitors, and Saboteurs: Fear and Freedom in America",2016-02-06,2016-05-08,THE MISSOURI HISTORY MUSEUM IN FOREST PARK,ARTS & ENTERTAINMENT
March Morpho Mania,2016-03-01,2016-03-31,SOPHIA M. SACHS BUTTERFLY HOUSE,ARTS & ENTERTAINMENT
The Carpet and the Connoisseur: The James F. Ballard Collection of Oriental Rugs,2016-03-06,2016-05-08,THE SAINT LOUIS ART MUSEUM IN FOREST PARK,ARTS & ENTERTAINMENT
Molly's Hammer (Dates Vary),2016-03-09,2016-03-27,THE LORETTO-HILTON CENTER FOR THE PERFORMING ARTS AT WEBSTER UNIVERSITY,ARTS & ENTERTAINMENT
Around the World in 80 Minutes (Sheldon Ballroom Series),2016-03-14,2016-03-15,THE SHELDON CONCERT HALL & ART GALLERIES IN GRAND CENTER,MUSIC
If/Then A New Musical,2016-03-15,2016-03-27,THE FOX THEATRE IN GRAND CENTER,ARTS & ENTERTAINMENT
Camera Work (IPHF Exhibition),2016-03-16,2016-07-02,INTERNATIONAL PHOTOGRAPHY HALL OF FAME AND MUSEUM,ARTS & ENTERTAINMENT
Dee Dee Bridgewater | Irvin Mayfield with the New Orleans 7 (Jazz at the Bistro Concert Series),2016-03-16,2016-03-19,FERRING JAZZ BISTRO IN GRAND CENTER,MUSIC
Satchel Paige and the Kansas City Swing,2016-03-16,2016-04-10,ARTS & ENTERTAINMENT,
Satchel Paige and the Kansas City Swing (Dates Vary),2016-03-16,2016-04-10,ARTS & ENTERTAINMENT,
Springtime Village 2016 at Purina Farms,2016-03-16,2016-04-03,PURINA FARMS,ARTS & ENTERTAINMENT
33rd Annual Ancient Order of Hibernians' Dogtown St. Patrick's Day Parade,2016-03-17,2016-03-17,DOGTOWN NEIGHBORHOOD,ANNUAL EVENTS
Old Wicked Songs (The New Jewish Theatre) DATES VARY,2016-03-17,2016-04-03,MARVIN & HARLENE WOOL STUDIO THEATER ON THE MILLSTONE CAMPUS OF JEWISH COMMUNITY CENTER,ARTS & ENTERTAINMENT
2016 NCAA? Men's Basketball Championship (Dates Vary),2016-03-18,2016-03-20,SCOTTRADE CENTER,SPORTING EVENTS
Free Family Night at the Magic House,2016-03-18,2016-03-18,"THE MAGIC HOUSE, ST. LOUIS CHILDREN'S MUSEUM",ARTS & ENTERTAINMENT
Halen Plays Beethoven (STL Symphony Concert),2016-03-18,2016-03-20,POWELL SYMPHONY HALL IN GRAND CENTER,MUSIC
In The Mood,2016-03-18,2016-03-18,BLANCHE M. TOUHILL PERFORMING ARTS CENTER AT UNIVERSITY OF MISSOURI-ST. LOUIS,MUSIC
Swedish Easter Paskbord Celebration at IKEA,2016-03-18,2016-03-18,IKEA ST. LOUIS,CATEGORY:PUBLIC
Crossing Rivers,2016-03-19,2016-03-19,EDISON THEATRE AT WASHINGTON UNIVERSITY,ARTS & ENTERTAINMENT
The Women of Faust Historic Village,2016-03-19,2016-03-20,FAUST PARK HISTORIC VILLAGE,ARTS & ENTERTAINMENT
Movie Night at Ballpark Village - Big Hero 6,2016-03-23,2016-03-23,BALLPARK VILLAGE SAINT LOUIS,ARTS & ENTERTAINMENT
Carrie Underwood: The Storyteller Tour Stories in the Round,2016-03-24,2016-03-24,CHAIFETZ ARENA AT SAINT LOUIS UNIVERSITY,MUSIC
St. Louis Blues Hockey Game,2016-03-25,2016-03-25,SCOTTRADE CENTER,SPORTING EVENTS
The Who Hits 50!,2016-03-26,2016-03-26,SCOTTRADE CENTER,MUSIC
Gateway Arch Riverboat Sunday Brunch Cruise,2016-03-27,2016-03-27,GATEWAY ARCH RIVERBOATS,ARTS & ENTERTAINMENT
Mr. Klein,2016-03-27,2016-03-27,"HOLOCAUST MUSEUM & LEARNING CENTER THEATER, JEWISH FEDERATION KOPOLOW BUILDING",ARTS & ENTERTAINMENT
St. Louis Blues Hockey Game,2016-03-29,2016-03-29,SCOTTRADE CENTER,SPORTING EVENTS
Julia Bullock (soprano) and Renate Rohlfing (piano),2016-03-30,2016-03-30,THE SHELDON CONCERT HALL & ART GALLERIES IN GRAND CENTER,MUSIC
SFJAZZ Collective: Originals & The Music of Michael Jackson (Jazz at the Bistro Concert Series),2016-03-30,2016-04-02,FERRING JAZZ BISTRO IN GRAND CENTER,MUSIC
2Cellos Live at the Fabulous Fox,2016-03-31,2016-03-31,THE FABULOUS FOX THEATRE IN GRAND CENTER,ARTS & ENTERTAINMENT
38th Annual Spring Art Fair at Queeny Park,2016-04-01,2016-04-03,GREENSFELDER RECREATION CENTER IN QUEENY PARK,ANNUAL EVENTS
Dark Matter: Terrence Boyd and Amanda McCavour,2016-04-01,2016-05-08,CRAFT ALLIANCE CENTER OF ART + DESIGN (DELMAR LOOP),ARTS & ENTERTAINMENT
Men Are From Mars - Women Are From Venus LIVE!,2016-04-01,2016-04-17,THE PLAYHOUSE AT WESTPORT PLAZA,ARTS & ENTERTAINMENT
Rock 'N Blues Concert for National Blues Museum,2016-04-01,2016-04-01,LUMI??RE LIVE,MUSICS
St. Louis Blues Hockey Game,2016-04-01,2016-04-01,SCOTTRADE CENTER,SPORTING EVENTS
Symphony Where You Worship Concert Series,2016-04-01,2016-04-01,SECOND PRESBYTERIAN CHURCH,MUSIC
The Kingston Trio (Sheldon Folk Series),2016-04-01,2016-04-01,THE SHELDON CONCERT HALL & ART GALLERIES IN GRAND CENTER,MUSIC
Tyler Perry's Madea On the Run,2016-04-01,2016-04-03,THE FABULOUS FOX THEATRE IN GRAND CENTER,ARTS & ENTERTAINMENT
Wale & Hoodie Allen,2016-04-01,2016-04-01,CHAIFETZ ARENA AT SAINT LOUIS UNIVERSITY,MUSIC
Wizard World Comic Con St. Louis,2016-04-01,2016-04-03,AMERICA'S CENTER,ARTS & ENTERTAINMENT
Dawn Weber (Sheldon Matinee Series),2016-04-02,2016-04-02,THE SHELDON CONCERT HALL & ART GALLERIES IN GRAND CENTER,MUSIC
Little Black Dress: From Mourning to Night Exhibit,2016-04-02,2016-09-05,THE MISSOURI HISTORY MUSEUM IN FOREST PARK,ARTS & ENTERTAINMENT
Mahler 4 (STL Symphony Concert),2016-04-02,2016-04-03,POWELL SYMPHONY HALL IN GRAND CENTER,MUSIC
Meet Me Outdoors in St. Louis Weekend Festival,2016-04-02,2016-04-03,MISSOURI BOTANICAL GARDEN,ARTS & ENTERTAINMENT
St. Louis Scott Gallagher Boys College Showcase,2016-04-02,2016-04-03,MUELLER SOCCER COMPLEX,SPORTING EVENTS
Styx,2016-04-03,2016-04-03,PEABODY OPERA HOUSE,MUSIC
St. Louis Blues Hockey Game,2016-04-04,2016-04-03,SCOTTRADE CENTER,SPORTING EVENTS
Kirk Franklin: 20 Years in One Night,2016-04-05,2016-04-03,PEABODY OPERA HOUSE,ARTS & ENTERTAINMENT
The Bridges of Madison County,2016-04-05,2016-04-17,THE FOX THEATRE IN GRAND CENTER,ARTS & ENTERTAINMENT
Wack-A-Doo (Sheldon Coffee Series),2016-04-05,2016-04-06,THE SHELDON CONCERT HALL & ART GALLERIES IN GRAND CENTER,MUSIC
"David Halen, Peter Martin and members of the St. Louis Symphony (Sheldon Classics Series)",2016-04-06,2016-04-06,THE SHELDON CONCERT HALL & ART GALLERIES IN GRAND CENTER,MUSIC
Kenny Barron Trio (Jazz at the Bistro Concert Series),2016-04-06,2016-04-07,FERRING JAZZ BISTRO IN GRAND CENTER,MUSIC
Symphony Where You Worship Concert Series,2016-04-06,2016-04-06,CANAAN BAPTIST CHURCH,MUSIC
Where the Wild Things Are,2016-04-07,2016-04-10,COCA,ARTS & ENTERTAINMENT
"Anat Cohen, Matt Wilson, Marquis Hill, & Linda Oh (Jazz at the Bistro Concert Series)",2016-04-08,2016-04-09,FERRING JAZZ BISTRO IN GRAND CENTER,MUSIC
Briefs Festival of Short LGBTQ Plays,2016-04-08,2016-04-10,CENTENE CENTER FOR THE ARTS,ARTS & ENTERTAINMENT
"Choir of St. John's College, Cambridge (St. Louis Cathedral Concert)",2016-04-08,2016-04-06,CATHEDRAL BASILICA OF SAINT LOUIS,MUSIC
E.T. the Extra-Terrestrial (STL Symphony Live at Powell Hall Concert),2016-04-08,2016-04-10,POWELL SYMPHONY HALL IN GRAND CENTER,MUSIC
GO! St. Louis Marathon & Family Fitness Weekend,2016-04-09,2016-04-10,DOWNTOWN STL,SPORTING EVENTS
Sheldon 2016 Gala- Chita Rivera,2016-04-09,2016-04-09,THE SHELDON CONCERT HALL & ART GALLERIES IN GRAND CENTER,ARTS & ENTERTAINMENT
St. Louis Blues Hockey,2016-04-09,2016-04-09,SCOTTRADE CENTER,SPORTING EVENTS
Inaugural Champions League Charity Basketball Game,2016-04-10,2016-04-10,CHAIFETZ ARENA AT SAINT LOUIS UNIVERSITY,ARTS & ENTERTAINMENT
Italian Film Festival USA of St. Louis (Dates Vary),2016-04-10,2016-04-26,WASHINGTON UNIVERSITY AND MISSOURI HISTORY MUSEUM,ANNUAL EVENTS
Underoath Rebirth Tour 2016,2016-04-10,2016-04-10,THE PAGEANT,MUSIC
Underoath: Rebirth Tour 2016,2016-04-10,2016-04-10,THE PAGEANT,MUSIC
St. Louis Cardinals Baseball Game,2016-04-11,2016-04-11,BUSCH STADIUM,SPORTING EVENTS
Woodwind Chimes (Sheldon Ballroom Series),2016-04-11,2016-04-12,THE SHELDON CONCERT HALL & ART GALLERIES IN GRAND CENTER,MUSIC
David Sanborn (Jazz at the Bistro Concert Series),2016-04-13,2016-04-16,FERRING JAZZ BISTRO IN GRAND CENTER,MUSIC
St. Louis Cardinals Baseball Game,2016-04-13,2016-04-13,BUSCH STADIUM,SPORTING EVENTS
Wild Kratts LIVE!,2016-04-13,2016-04-13,PEABODY OPERA HOUSE,ARTS & ENTERTAINMENT
"PowerShares Series Tennis: McEnroe, Roddick, Blake, Courier",2016-04-14,2016-04-14,CHAIFETZ ARENA AT SAINT LOUIS UNIVERSITY,SPORTING EVENTS
St. Louis Cardinals Baseball Game,2016-04-14,2016-04-14,BUSCH STADIUM,SPORTING EVENTS
Charles Kelley: The Driver Tour,2016-04-15,2016-04-15,THE PAGEANT,ARTS & ENTERTAINMENT
Free Family Night at the Magic House,2016-04-15,2016-04-15,"THE MAGIC HOUSE, ST. LOUIS CHILDREN'S MUSEUM",ARTS & ENTERTAINMENT
Pictures at an Exhibition (STL Symphony Concert),2016-04-15,2016-04-16,POWELL SYMPHONY HALL IN GRAND CENTER,MUSIC
St. Louis Cardinals Baseball Game,2016-04-15,2016-04-15,BUSCH STADIUM,SPORTING EVENTS
The Second City Hooking Up With The Second City,2016-04-15,2016-04-16,BLANCHE M. TOUHILL PERFORMING ARTS CENTER AT UNIVERSITY OF MISSOURI-ST. LOUIS,ARTS & ENTERTAINMENT
"Monster Energy AMA Supercross, An FIM World Championship",2016-04-16,2016-04-16,EDWARD JONES DOME,SPORTING EVENTS
St. Louis Cardinals Baseball Game,2016-04-16,2016-04-16,BUSCH STADIUM,SPORTING EVENTS
St. Louis Scott Gallager Spring Classic,2016-04-16,2016-04-17,WORLD WIDE TECHNOLOGY SOCCER PARK,SPORTING EVENTS
Variety's Dinner with the Stars: Lionel Richie,2016-04-16,2016-04-16,PEABODY OPERA HOUSE,ARTS & ENTERTAINMENT
Beethoven's New Groove (STL Symphony Family Concert),2016-04-17,2016-04-17,POWELL SYMPHONY HALL IN GRAND CENTER,MUSIC
Bento Rakugo presented by UMSL International Studies and Programs,2016-04-17,2016-04-17,BLANCHE M. TOUHILL PERFORMING ARTS CENTER AT UNIVERSITY OF MISSOURI-ST. LOUIS,ARTS & ENTERTAINMENT
Gateway Arch Riverboat Sunday Brunch Cruise,2016-04-17,2016-04-17,GATEWAY ARCH RIVERBOATS,ARTS & ENTERTAINMENT
Jew Suss: Rise and Fall (Jud Suss: Film ohne Gewissen),2016-04-17,2016-04-17,"HOLOCAUST MUSEUM & LEARNING CENTER THEATER, JEWISH FEDERATION KOPOLOW BUILDING",ARTS & ENTERTAINMENT
St. Louis Cardinals Baseball Game,2016-04-17,2016-04-17,BUSCH STADIUM,SPORTING EVENTS
Ragtime,2016-04-18,2016-04-19,PEABODY OPERA HOUSE,ARTS & ENTERTAINMENT
SIUE Concert Jazz Band & SIUE Alumni Jazz Band (Jazz at the Bistro Concert Series),2016-04-18,2016-04-18,FERRING JAZZ BISTRO IN GRAND CENTER,MUSIC
St. Louis Cardinals Baseball Game,2016-04-18,2016-04-18,BUSCH STADIUM,SPORTING EVENTS
Justin Bieber: Purpose World Tour,2016-04-19,2016-04-19,SCOTTRADE CENTER,MUSIC
SHAKE 38,2016-04-19,2016-04-23,VARIOUS VENUES,ANNUAL EVENTS
St. Louis Cardinals Baseball Game,2016-04-19,2016-04-19,BUSCH STADIUM,SPORTING EVENTS
Be a Tourist in Your Own Town,2016-04-20,2016-04-20,BALLPARK VILLAGE SAINT LOUIS,ANNUAL EVENTS
Pulitzer Arts Foundation Contemporary Concert Series,2016-04-20,2016-04-20,THE PULITZER ARTS FOUNDATION,MUSIC
St. Louis Cardinals Baseball Game,2016-04-20,2016-04-20,BUSCH STADIUM,SPORTING EVENTS
"The Black Rep 2015-16 ??Edison Series?? presents ""isted Melodies""  ",2016-04-20,2016-05-01,EDISON THEATRE AT WASHINGTON UNIVERSITY,ARTS & ENTERTAINMENTUI
Bill Burr: Third Party Tour,2016-04-22,2016-04-22,THE FOX THEATRE IN GRAND CENTER,ARTS & ENTERTAINMENT
Bosnian/American,2016-04-22,2016-05-01,THE FONTBONNE UNIVERSITY FINE ARTS THEATRE,ARTS & ENTERTAINMENT
Dvor??k 7 (STL Symphony Concert),2016-04-22,2016-04-24,POWELL SYMPHONY HALL IN GRAND CENTER,MUSICI
Greater St. Louis Jazz Festival 2016,2016-04-22,2016-04-23,BLANCHE M. TOUHILL PERFORMING ARTS CENTER AT UNIVERSITY OF MISSOURI-ST. LOUIS,MUSIC
Symphony Where You Worship Concert Series,2016-04-22,2016-04-22,MESSIAH LUTHERAN CHURCH,MUSIC
Thornhill Open House,2016-04-23,2016-04-24,THORNHILL MANSION AT FAUST PARK,ANNUAL EVENTS
27th Annual St. Louis Earth Day Festival,2016-04-24,2016-04-24,THE MUNY GROUNDS IN FOREST PARK,ANNUAL EVENTS
95.5 Spring Jam - Anthony Hamilton,2016-04-24,2016-04-24,THE FOX THEATRE IN GRAND CENTER,ARTS & ENTERTAINMENT
Bill Maher,2016-04-24,2016-04-24,PEABODY OPERA HOUSE,ARTS & ENTERTAINMENT
The Sound of Music,2016-04-26,2016-05-08,THE FOX THEATRE IN GRAND CENTER,ARTS & ENTERTAINMENT
FIRST Robotics Championship,2016-04-27,2016-04-30,THE DOME AT AMERICA'S CENTER,SPORTING EVENTS
Melissa Aldana (Jazz at the Bistro Concert Series),2016-04-27,2016-04-30,FERRING JAZZ BISTRO IN GRAND CENTER,MUSIC
CMT presents Jennifer Nettles with Next Women of Country Tour,2016-04-28,2016-04-28,PEABODY OPERA HOUSE,ARTS & ENTERTAINMENT
St. Louis Cardinals Baseball Game,2016-04-29,2016-04-29,BUSCH STADIUM,SPORTING EVENTS
Storytelling (STL Symphony Concert),2016-04-29,2016-04-29,POWELL SYMPHONY HALL IN GRAND CENTER,MUSIC
"Schubert ""Great"" (STL Symphony Concert)",2016-04-30,2016-05-01,POWELL SYMPHONY HALL IN GRAND CENTER,MUSIC
St. Louis Cardinals Baseball Game,2016-04-30,2016-04-30,BUSCH STADIUM,SPORTING EVENTS
Tea with Nancy,2016-04-30,2016-04-30,THORNHILL MANSION AT FAUST PARK,ARTS & ENTERTAINMENT
St. Louis Cardinals Baseball Game,2016-05-01,2016-05-01,BUSCH STADIUM,SPORTING EVENTS
Hardcore Classics 2016 (Sheldon Ballroom Series),2016-05-02,2016-05-03,THE SHELDON CONCERT HALL & ART GALLERIES IN GRAND CENTER,MUSIC
St. Louis Cardinals Baseball Game,2016-05-02,2016-05-02,BUSCH STADIUM,SPORTING EVENTS
St. Louis Cardinals Baseball Game,2016-05-03,2016-05-03,BUSCH STADIUM,SPORTING EVENTS
St. Louis Cardinals Baseball Game,2016-05-04,2016-05-04,BUSCH STADIUM,SPORTING EVENTS
36th Annual St. Louis Storytelling Festival,2016-05-05,2016-05-07,LOCATIONS THROUGHOUT THE ST. LOUIS METROPOLITAN AREA AND IN ST. CHARLES COUNTY,ANNUAL EVENTS
Bullets over Broadway,2016-05-05,2016-05-05,PEABODY OPERA HOUSE,ARTS & ENTERTAINMENT
St. Louis Cardinals Baseball Game,2016-05-05,2016-05-05,BUSCH STADIUM,SPORTING EVENTS
21st Annual St. Louis Microfest Beer Festival,2016-05-06,2016-05-07,LOWER MUNY PARKING LOT AND THEATRE DRIVE,ANNUAL EVENTS
Arianna String Quartet: Beethoven's Triumph,2016-05-06,2016-05-06,BLANCHE M. TOUHILL PERFORMING ARTS CENTER AT UNIVERSITY OF MISSOURI-ST. LOUIS,MUSIC
Art Fair at Laumeier,2016-05-06,2016-05-08,LAUMEIER SCULPTURE PARK,ANNUAL EVENTS
"Great Rivers Biennial: Lyndon Barrois Jr., Nanette Boileau, and Tate Foley",2016-05-06,2016-08-07,CONTEMPORARY ART MUSEUM ST. LOUIS,ARTS & ENTERTAINMENT
Mark Bradford,2016-05-06,2016-08-07,CONTEMPORARY ART MUSEUM ST. LOUIS,ARTS & ENTERTAINMENT
Nomad Studio: Green Air,2016-05-06,2016-05-06,CONTEMPORARY ART MUSEUM ST. LOUIS,ARTS & ENTERTAINMENT
St. Louis Cardinals Baseball,2016-05-06,2016-05-06,BUSCH STADIUM,SPORTING EVENTS
The Planets (STL Symphony Concert),2016-05-06,2016-05-08,POWELL SYMPHONY HALL IN GRAND CENTER,MUSIC
Cyrus Chestnut: African Reflections (Sheldon Jazz Series),2016-05-07,2016-05-07,THE SHELDON CONCERT HALL & ART GALLERIES IN GRAND CENTER,MUSIC
St. Louis Cardinals Baseball Game,2016-05-07,2016-05-07,BUSCH STADIUM,SPORTING EVENTS
Thornhill Open House,2016-05-07,2016-05-08,THORNHILL MANSION AT FAUST PARK,ANNUAL EVENTS
Wild Bacon Wine Trail,2016-05-07,2016-05-08,"HERMANN, MISSOURI",ANNUAL EVENTS
St. Louis Cardinals Baseball,2016-05-08,2016-05-08,BUSCH STADIUM,SPORTING EVENTS
Tim Schall (Sheldon Coffee Series),2016-05-10,2016-05-11,THE SHELDON CONCERT HALL & ART GALLERIES IN GRAND CENTER,MUSIC
First Annual Tennessee Williams Festival St. Louis,2016-05-11,2016-05-15,VARIOUS VENUES,ANNUAL EVENTS
Pat Martino Trio (Jazz at the Bistro Concert Series),2016-05-11,2016-05-14,FERRING JAZZ BISTRO IN GRAND CENTER,MUSIC
Pulitzer Arts Foundation Contemporary Concert Series,2016-05-11,2016-05-11,THE PULITZER ARTS FOUNDATION,MUSIC
Feast in the Park at Faust,2016-05-12,2016-05-12,FAUST PARK HISTORIC VILLAGE,ARTS & ENTERTAINMENT
Yentl (The New Jewish Theatre) DATES VARY,2016-05-12,2016-06-05,MARVIN & HARLENE WOOL STUDIO THEATER ON THE MILLSTONE CAMPUS OF JEWISH COMMUNITY CENTER,ARTS & ENTERTAINMENT
15th Annual Art on the Square,2016-05-13,2016-05-15,"BELLEVILLE PUBLIC SQUARE, BELLEVILLE, ILLINOIS",ANNUAL EVENTS
Cathedra (St. Louis Cathedral Concert),2016-05-13,2016-05-13,CATHEDRAL BASILICA OF SAINT LOUIS,SPORTING EVENTS
2016 Spirit of St. Louis Airport Airshow and STEM Expo presented by Boeing,2016-05-14,2016-05-15,SPIRIT OF ST. LOUIS AIRPORT IN CHESTERFIELD,ARTS & ENTERTAINMENT
Brian Owens (Sheldon Matinee Series),2016-05-14,2016-05-14,THE SHELDON CONCERT HALL & ART GALLERIES IN GRAND CENTER,MUSIC
Cinderella,2016-05-14,2016-05-15,EDISON THEATRE AT WASHINGTON UNIVERSITY,ARTS & ENTERTAINMENT
Pok??mon: Symphonic Evolutions (STL Symphony Live at Powell Hall Concert),2016-05-14,2016-05-15,POWELL SYMPHONY HALL IN GRAND CENTER,MUSICE
Thornhill Open House,2016-05-14,2016-05-15,THORNHILL MANSION AT FAUST PARK,ANNUAL EVENTS
Ellie Goulding Delirium World Tour 2016,2016-05-16,2016-05-16,CHAIFETZ ARENA AT SAINT LOUIS UNIVERSITY,MUSIC
Jersey Boys,2016-05-18,2016-05-22,THE FOX THEATRE IN GRAND CENTER,ARTS & ENTERTAINMENT
St. Louis Cardinals Baseball Game,2016-05-18,2016-05-18,BUSCH STADIUM,SPORTING EVENTS
St. Louis Cardinals Baseball,2016-05-19,2016-05-19,BUSCH STADIUM,SPORTING EVENTS
2016 Artists-In-Residence Exhibition,2016-05-20,2016-06-26,CRAFT ALLIANCE CENTER OF ART + DESIGN (DELMAR LOOP),ARTS & ENTERTAINMENT
Free Family Night at the Magic House,2016-05-20,2016-05-20,"THE MAGIC HOUSE, ST. LOUIS CHILDREN'S MUSEUM",ARTS & ENTERTAINMENT
Music of Michael Jackson (STL Symphony Live at Powell Hall Concert),2016-05-20,2016-05-20,POWELL SYMPHONY HALL IN GRAND CENTER,MUSIC
St. Louis Cardinals Baseball Game,2016-05-20,2016-05-20,BUSCH STADIUM,SPORTING EVENTS
Bruce Hornsby & The Noisemakers,2016-05-21,2016-05-21,EVENT CENTER AT RIVER CITY CASINO & HOTEL,MUSIC
La boh??me (Opera Theatre of Saint Louis),2016-05-21,2016-05-21,THE LORETTO-HILTON CENTER FOR THE PERFORMING ARTS AT WEBSTER UNIVERSITY,ARTS & ENTERTAINMENTD
Spring at the Sun,2016-05-21,2016-05-21,THE SUN THEATER IN GRAND CENTER,ARTS & ENTERTAINMENT
St. Louis Cardinals Baseball Game,2016-05-21,2016-05-21,BUSCH STADIUM,SPORTING EVENTS
Jim Brickman (STL Symphony Live at Powell Hall Concert),2016-05-22,2016-05-22,POWELL SYMPHONY HALL IN GRAND CENTER,MUSIC
St. Louis Cardinals Baseball Game,2016-05-22,2016-05-22,BUSCH STADIUM,SPORTING EVENTS
St. Louis Cardinals Baseball Game,2016-05-23,2016-05-23,BUSCH STADIUM,SPORTING EVENTS
St. Louis Cardinals Baseball Game,2016-05-24,2016-05-24,BUSCH STADIUM,SPORTING EVENTS
Freddy Cole Quintet featuring Harry Allen (Jazz at the Bistro Concert Series),2016-05-25,2016-05-28,FERRING JAZZ BISTRO IN GRAND CENTER,MUSIC
La boh??me (Opera Theatre of Saint Louis),2016-05-25,2016-05-25,THE LORETTO-HILTON CENTER FOR THE PERFORMING ARTS AT WEBSTER UNIVERSITY,ARTS & ENTERTAINMENTD
St. Louis Cardinals Baseball Game,2016-05-25,2016-05-25,BUSCH STADIUM,SPORTING EVENTS
Alarm Will Sound,2016-05-26,2016-05-26,THE SHELDON CONCERT HALL & ART GALLERIES IN GRAND CENTER,MUSIC
La boh??me (Opera Theatre of Saint Louis),2016-05-27,2016-05-27,THE LORETTO-HILTON CENTER FOR THE PERFORMING ARTS AT WEBSTER UNIVERSITY,ARTS & ENTERTAINMENTD
Schlafly Art Outside,2016-05-27,2016-05-29,SCHLAFLY BOTTLEWORKS,ANNUAL EVENTS
SPRING TO DANCE? FESTIVAL 2016 presented by Dance St. Louis & The Touhill,2016-05-27,2016-05-29,BLANCHE M. TOUHILL PERFORMING ARTS CENTER AT UNIVERSITY OF MISSOURI-ST. LOUIS,ANNUAL EVENTS
Macbeth (Opera Theatre of Saint Louis),2016-05-28,2016-05-28,THE LORETTO-HILTON CENTER FOR THE PERFORMING ARTS AT WEBSTER UNIVERSITY,ARTS & ENTERTAINMENT
St. Louis Scott Gallagher Gateway Memorial Classic,2016-05-28,2016-05-30,WORLD WIDE TECHNOLOGY SOCCER PARK,SPORTING EVENTS
Gypsy Caravan,2016-05-30,2016-05-30,THE FAMILY ARENA,ANNUAL EVENTS
Macbeth (Opera Theatre of Saint Louis),2016-06-01,2016-06-01,THE LORETTO-HILTON CENTER FOR THE PERFORMING ARTS AT WEBSTER UNIVERSITY,ARTS & ENTERTAINMENT
Circus Flora,2016-06-02,2016-07-03,CIRCUS FLORA,ARTS & ENTERTAINMENT
La boh??me (Opera Theatre of Saint Louis),2016-06-02,2016-06-02,THE LORETTO-HILTON CENTER FOR THE PERFORMING ARTS AT WEBSTER UNIVERSITY,ARTS & ENTERTAINMENTM
The Big Muddy Ball,2016-06-02,2016-06-02,THE SHELDON CONCERT HALL & ART GALLERIES IN GRAND CENTER,ARTS & ENTERTAINMENT
13th annual Webster Arts Fair,2016-06-03,2016-06-05,"WEBSTER GROVES, MO",ANNUAL EVENTS
St. Louis Cardinals Baseball Game,2016-06-03,2016-06-03,BUSCH STADIUM,SPORTING EVENTS
"STAGES St. Louis presents ""It Shoulda Been You""",2016-06-03,2016-07-03,STAGES ST. LOUIS,ARTS & ENTERTAINMENT
15th Annual Green Homes Festival hosted by EarthWays Center,2016-06-04,2016-06-04,MISSOURI BOTANICAL GARDEN,ANNUAL EVENTS
Kimmswick Strawberry Festival,2016-06-04,2016-06-05,"KIMMSWICK, MISSOURI",ANNUAL EVENTS
La boh??me (Opera Theatre of Saint Louis),2016-06-04,2016-06-04,THE LORETTO-HILTON CENTER FOR THE PERFORMING ARTS AT WEBSTER UNIVERSITY,ARTS & ENTERTAINMENTM
Mary Chapin Carpenter (STL Symphony Live at Powell Hall Concert),2016-06-04,2016-06-04,POWELL SYMPHONY HALL IN GRAND CENTER,MUSIC
Midtown Taste ART FAIR,2016-06-04,2016-06-05,LOCUST STREET,ARTS & ENTERTAINMENT
St. Louis Cardinals Baseball Game,2016-06-04,2016-06-04,BUSCH STADIUM,SPORTING EVENTS
Ariadne on Naxos (Opera Theatre of Saint Louis),2016-06-05,2016-06-05,THE LORETTO-HILTON CENTER FOR THE PERFORMING ARTS AT WEBSTER UNIVERSITY,ARTS & ENTERTAINMENT
St. Louis Cardinals Baseball Game,2016-06-05,2016-06-05,BUSCH STADIUM,SPORTING EVENTS
Chesterfield Chamber of Commerce Summer Concert Series,2016-06-07,2016-06-07,FAUST PARK,MUSIC
La boh??me (Opera Theatre of Saint Louis),2016-06-08,2016-06-08,THE LORETTO-HILTON CENTER FOR THE PERFORMING ARTS AT WEBSTER UNIVERSITY,ARTS & ENTERTAINMENTA
Leon Bridges,2016-06-08,2016-06-08,THE PAGEANT,MUSIC
Twangfest,2016-06-08,2016-06-11,OFF BROADWAY,ANNUAL EVENTS
Ariadne on Naxos (Opera Theatre of Saint Louis),2016-06-09,2016-06-09,THE LORETTO-HILTON CENTER FOR THE PERFORMING ARTS AT WEBSTER UNIVERSITY,ARTS & ENTERTAINMENT
Feast in the Park at Faust,2016-06-09,2016-06-09,FAUST PARK HISTORIC VILLAGE,ARTS & ENTERTAINMENT
The Avett Brothers,2016-06-09,2016-06-09,CHAIFETZ ARENA AT SAINT LOUIS UNIVERSITY,MUSIC
10th Annual St. Louis Brewers Guild Heritage Festival,2016-06-10,2016-06-11,FOREST PARK CENTRAL FIELD,ANNUAL EVENTS
Faust Olden Days of Summer,2016-06-10,2016-06-10,FAUST PARK HISTORIC VILLAGE,ANNUAL EVENTS
Macbeth (Opera Theatre of Saint Louis),2016-06-10,2016-06-10,THE LORETTO-HILTON CENTER FOR THE PERFORMING ARTS AT WEBSTER UNIVERSITY,ARTS & ENTERTAINMENT
Music of Led Zeppelin (STL Symphony Live at Powell Hall Concert),2016-06-10,2016-06-10,POWELL SYMPHONY HALL IN GRAND CENTER,MUSIC
Ariadne on Naxos (Opera Theatre of Saint Louis),2016-06-11,2016-06-11,THE LORETTO-HILTON CENTER FOR THE PERFORMING ARTS AT WEBSTER UNIVERSITY,ARTS & ENTERTAINMENT
Shalimar the Clown (Opera Theatre of Saint Louis),2016-06-11,2016-06-11,THE LORETTO-HILTON CENTER FOR THE PERFORMING ARTS AT WEBSTER UNIVERSITY,ARTS & ENTERTAINMENT
La boh??me (Opera Theatre of Saint Louis),2016-06-12,2016-06-12,THE LORETTO-HILTON CENTER FOR THE PERFORMING ARTS AT WEBSTER UNIVERSITY,ARTS & ENTERTAINMENTR
Music of Billy Joel (STL Symphony Live at Powell Hall Concert),2016-06-12,2016-06-12,POWELL SYMPHONY HALL IN GRAND CENTER,MUSIC
The Wizard of Oz,2016-06-13,2016-06-22,THE MUNY IN FOREST PARK,ARTS & ENTERTAINMENT
Chesterfield Chamber of Commerce Summer Concert Series,2016-06-14,2016-06-14,FAUST PARK,MUSIC
Jane Lynch - See Jane Sing,2016-06-14,2016-06-14,THE SHELDON CONCERT HALL & ART GALLERIES IN GRAND CENTER,MUSIC
St. Louis Cardinals Baseball Game,2016-06-14,2016-06-14,BUSCH STADIUM,SPORTING EVENTS
La boh??me (Opera Theatre of Saint Louis),2016-06-15,2016-06-15,THE LORETTO-HILTON CENTER FOR THE PERFORMING ARTS AT WEBSTER UNIVERSITY,ARTS & ENTERTAINMENTR
Shalimar the Clown (Opera Theatre of Saint Louis),2016-06-15,2016-06-15,THE LORETTO-HILTON CENTER FOR THE PERFORMING ARTS AT WEBSTER UNIVERSITY,ARTS & ENTERTAINMENT
St. Louis Cardinals Baseball Game,2016-06-15,2016-06-15,BUSCH STADIUM,SPORTING EVENTS
Macbeth (Opera Theatre of Saint Louis),2016-06-16,2016-06-16,THE LORETTO-HILTON CENTER FOR THE PERFORMING ARTS AT WEBSTER UNIVERSITY,ARTS & ENTERTAINMENT
Gateway Men's Chorus: Big Gay Sing,2016-06-17,2016-06-18,EDISON THEATRE AT WASHINGTON UNIVERSITY,MUSIC
Macy Gray (STL Symphony Live at Powell Hall Concert),2016-06-17,2016-06-17,POWELL SYMPHONY HALL IN GRAND CENTER,MUSIC
